[
  {
    "schema_version": "1.0",
    "work_item_id": "TRACE-1",
    "date": "2026-01-02",
    "verdict": "pass",
    "criteria": [
      {
        "ac_id": "AC-1",
        "status": "pass",
        "evidence": [
          {
            "type": "test",
            "name": "login works",
            "file": "tests/a.test.ts",
            "line": 12,
            "run_log": "✓ login works (4 ms)"
          },
          {
            "type": "file",
            "name": "session refresh issues a new sid cookie",
            "file": "src/auth/session.ts",
            "line_range": "20-41"
          }
        ]
      },
      {
        "ac_id": "AC-2",
        "status": "pass",
        "evidence": [
          { "type": "test", "name": "prorates", "file": "tests/a.test.ts", "line": 30 },
          { "type": "command", "name": "bun run check:types", "run_log": "exit 0" }
        ]
      }
    ],
    "summary": { "pass": 2, "fail": 0, "partial": 0, "not_verified": 0 }
  },
  {
    "schema_version": "1.0",
    "work_item_id": "TRACE-1",
    "date": "2026-01-02",
    "verdict": "gaps",
    "criteria": [
      {
        "ac_id": "AC-1",
        "status": "partial",
        "evidence": [{ "type": "lint_rule", "name": "no-floating-promises", "file": "biome.json" }],
        "gap": "Negative path (expired refresh token) has no test.",
        "suggested_action": "Add a test asserting 401 for an expired refresh token."
      }
    ],
    "summary": { "pass": 0, "fail": 0, "partial": 1, "not_verified": 0 }
  }
]
